{
  "schema": "al-isabah.entry.v1",
  "id": "isabah-entry-00012002",
  "work_id": "ibn-hajar-al-isabah",
  "edition_id": "dar-al-kutub-al-ilmiyyah-1995",
  "printed_entry_number": 12002,
  "title": {
    "english": "Umm Kharija³:",
    "arabic_observed": "أم خارجة «٣»"
  },
  "segments": [
    {
      "id": "isabah-entry-00012002-segment-0001",
      "volume": 8,
      "scan_page": 385,
      "printed_page": 384,
      "reader_page": 4297,
      "reader_url": "https://usul.ai/t/isaba-fi-tamyiz/4297",
      "source_unit_id": "ibn_hajar_isabah_v1:arabic:v08:p0385:9f5dbcc10c3dfc02",
      "arabic": "١٢٠٠٢- أم خارجة «٣»\n: امرأة زيد بن ثابت\nأورد ابن أبي عاصم، من طريق عبيد اللَّه بن أبي زياد، حدثنا أبو بكر بن عبد اللَّه بن أبي ربيعة، حدثتني أم خارجة امرأة زيد بن\n(١) أسد الغابة ت (٧٤١٨) .\n(٢) أسد الغابة ت (٧٤٢٩) .\n(٣) أسد الغابة ت (٧٤٢٨)، تجريد أسماء الصحابة ٢/ ٣١٨.",
      "english": "12002—Umm Kharija³:\n\nThe wife of Zayd ibn Thabit.\n\nIbn Abi 'Asim cited, through the route of 'Ubayd Allah ibn Abi Ziyad: Abu Bakr ibn 'Abd Allah ibn Abi Rabi'a narrated to us: I was told by Umm Kharija, the wife of Zayd ibn—\n\n(1) Usd al-Ghaba, entry 7418.\n\n(2) Usd al-Ghaba, entry 7429.\n\n(3) Usd al-Ghaba, entry 7428; al-Tajrid, 2/318.",
      "arabic_sha256": "fcd9e5420493ce443e836bf909563379f08e277dd27ddb9fd0edac97c3b34774",
      "english_sha256": "df9df5a0a320f8abd5fa259f93f09d2bbd99a7b62f6aa5e7a1c836d75247d21c",
      "machine_state": "machine_validated_unresolved"
    },
    {
      "id": "isabah-entry-00012002-segment-0002",
      "volume": 8,
      "scan_page": 386,
      "printed_page": 385,
      "reader_page": 4298,
      "reader_url": "https://usul.ai/t/isaba-fi-tamyiz/4298",
      "source_unit_id": "ibn_hajar_isabah_v1:arabic:v08:p0386:e1ff388273593787",
      "arabic": "ثابت، قال: أتينا رسول اللَّه ﵌ في حائط ومعه أصحابه إذ قال: «أوّل رجل يطلع عليكم فهو من أهل الجنّة»، فليس أحد منا إلا وهو يتمنى أن يكون من وراء الحائط، قالت: فبينما نحن كذلك إذا سمعنا حسا فرفعنا أبصارنا إليه ننظر من يدخل، فقال رسول اللَّه ﵌: «عسى أن يكون علي بن أبي طالب» .\nوذكر أبو نعيم أن مكي بن إبراهيم تابعه عن أبي بكر، أخرجه ابن مندة من وجهين:\nعن أبي عبد الرحيم الحراني، عن محمد بن عبد اللَّه بن أبي صعصعة، عن أبيه، عن أم خارجة بنت سعد بن ربيع، عن أبي مرثد. وستأتي.",
      "english": "Thabit. She said: “We came to the Messenger of Allah (may Allah bless him and grant him peace) in a walled garden while his Companions were with him. He said, ‘The first man to appear before you is one of the people of Paradise.’ There was not one of us who did not wish that he might be the one beyond the wall.” She said: “While we were thus, we heard a sound, so we raised our eyes toward it to see who would enter. The Messenger of Allah (may Allah bless him and grant him peace) said, ‘Perhaps it will be Ali ibn Abi Talib.’”\n\nAbu Nu'aym mentioned that Makki ibn Ibrahim reported the same from Abu Bakr. Ibn Manda transmitted it through two routes:\n\nFrom Abu Abd al-Rahim al-Harrani, from Muhammad ibn Abd Allah ibn Abi Sa'sa'a, from his father, from Umm Kharija bint Sa'd ibn al-Rabi', from Abu Marthad. She will be discussed later.",
      "arabic_sha256": "1c1e4a88980c145df032a6ee4da8599a02bc644e716992634b1897c715e2a91a",
      "english_sha256": "3f50e0e7f37187f364fa6dfa65266cd4b6eccb978f05bf39f4eda354ea77eb7a",
      "machine_state": "machine_validated_unresolved"
    }
  ],
  "names": [
    {
      "arabic": "أم خارجة",
      "english": "Umm Kharija",
      "kind": "person"
    },
    {
      "arabic": "زيد بن ثابت",
      "english": "Zayd ibn Thabit",
      "kind": "person"
    },
    {
      "arabic": "ابن أبي عاصم",
      "english": "Ibn Abi 'Asim",
      "kind": "person"
    },
    {
      "arabic": "عبيد اللَّه بن أبي زياد",
      "english": "'Ubayd Allah ibn Abi Ziyad",
      "kind": "person"
    },
    {
      "arabic": "أبو بكر بن عبد اللَّه بن أبي ربيعة",
      "english": "Abu Bakr ibn 'Abd Allah ibn Abi Rabi'a",
      "kind": "person"
    },
    {
      "arabic": "أسد الغابة",
      "english": "Usd al-Ghaba",
      "kind": "work"
    },
    {
      "arabic": "تجريد أسماء الصحابة",
      "english": "al-Tajrid",
      "kind": "work"
    },
    {
      "arabic": "الله",
      "english": "Allah",
      "kind": "other"
    },
    {
      "arabic": "رسول الله",
      "english": "Muhammad",
      "kind": "person"
    },
    {
      "arabic": "أم خارجة امرأة زيد بن ثابت",
      "english": "Umm Kharija",
      "kind": "person"
    },
    {
      "arabic": "الجنة",
      "english": "Paradise",
      "kind": "place"
    },
    {
      "arabic": "علي بن أبي طالب",
      "english": "Ali ibn Abi Talib",
      "kind": "person"
    },
    {
      "arabic": "أبو نعيم",
      "english": "Abu Nu'aym",
      "kind": "person"
    },
    {
      "arabic": "مكي بن إبراهيم",
      "english": "Makki ibn Ibrahim",
      "kind": "person"
    },
    {
      "arabic": "ابن مندة",
      "english": "Ibn Manda",
      "kind": "person"
    },
    {
      "arabic": "أبو عبد الرحيم الحراني",
      "english": "Abu Abd al-Rahim al-Harrani",
      "kind": "person"
    },
    {
      "arabic": "محمد بن عبد الله بن أبي صعصعة",
      "english": "Muhammad ibn Abd Allah ibn Abi Sa'sa'a",
      "kind": "person"
    },
    {
      "arabic": "عبد الله بن أبي صعصعة",
      "english": "Abd Allah ibn Abi Sa'sa'a",
      "kind": "person"
    },
    {
      "arabic": "أم خارجة بنت سعد بن ربيع",
      "english": "Umm Kharija bint Sa'd ibn al-Rabi'",
      "kind": "person"
    },
    {
      "arabic": "أبو مرثد",
      "english": "Abu Marthad",
      "kind": "person"
    }
  ],
  "unresolved": [],
  "translation": {
    "state": "translated",
    "machine_assessment": "passed",
    "human_review": "unreviewed"
  },
  "provenance": {
    "importer": "al-isabah.volume8-importer.v1",
    "source_artifact_id": "firstlight:firstlight-research/data/translated/ibn_hajar_isabah/arabic_v1/volume_08.translation-units.jsonl",
    "source_artifact_sha256": "f12585cea28d7c7b318728f74b1a95a0d8b2812cb25d6e70f1b9e7b0b9422a3f"
  }
}
