{
  "schema": "al-isabah.entry.v1",
  "id": "isabah-entry-00011610",
  "work_id": "ibn-hajar-al-isabah",
  "edition_id": "dar-al-kutub-al-ilmiyyah-1995",
  "printed_entry_number": 11610,
  "title": {
    "english": "Fatima bint al-Mujallal",
    "arabic_observed": "فاطمة بنت المجلل"
  },
  "segments": [
    {
      "id": "isabah-entry-00011610-segment-0001",
      "volume": 8,
      "scan_page": 278,
      "printed_page": 277,
      "reader_page": 4190,
      "reader_url": "https://usul.ai/t/isaba-fi-tamyiz/4190",
      "source_unit_id": "ibn_hajar_isabah_v1:arabic:v08:p0278:4f540644354a08bc",
      "arabic": "١١٦١٠- فاطمة بنت المجلل\nبن عبد اللَّه بن أبي قيس بن عبد ودّ بن نصر بن مالك بن حسل بن عامر بن لؤيّ القرشية العامرية، تكنى أم جميل «٢»، وهي بها أشهر.\nقال ابن إسحاق في رواية يونس بن بكير وغيره في مهاجرة الحبشة: هاجر حاطب بن الحارث ومعه امرأته فاطمة بنت المجلل، فتوفي زوجها هناك، وقدمت المدينة هي وابناها مع أهل السفينتين، فروى عبد اللَّه بن الحارث بن محمد بن حاطب، عن أبيه، عن جده، قال: لما قدمنا من أرض الحبشة خرجت بي أمي إلى النبي ﵌ ...\nفذكر الحديث المتقدم في محمد بن حاطب.",
      "english": "11610—Fatima bint al-Mujallal\n\nibn Abd Allah ibn Abi Qays ibn Abd Wudd ibn Nasr ibn Malik ibn Hisl ibn Amir ibn Lu'ayy, al-Qurashiyya al-'Amiriyya. Her kunyah was Umm Jamil [2], by which she is better known.\n\nIbn Ishaq said, in the recension of Yunus ibn Bukayr and others concerning the emigration to Abyssinia: Hatib ibn al-Harith emigrated, accompanied by his wife Fatima bint al-Mujallal. Her husband died there, and she and her two sons came to Medina with the people of the two ships. Abd Allah ibn al-Harith ibn Muhammad ibn Hatib narrated from his father, from his grandfather, who said: “When we arrived from the land of Abyssinia, my mother took me out to the Prophet—may Allah bless him and grant him peace…”\n\nHe then related the hadith cited previously in the entry on Muhammad ibn Hatib.",
      "arabic_sha256": "459d13e3c3d6dd34523f7804fc433239f42948ce45d24de8f455f6ab28777a31",
      "english_sha256": "265c2823772b691676bc55e6d33446eb6b999ed865b927b30357f8e13f0a1046",
      "machine_state": "machine_validated_unreviewed"
    }
  ],
  "names": [
    {
      "arabic": "قيس",
      "english": "Qays",
      "kind": "person"
    },
    {
      "arabic": "القرشية",
      "english": "al-Qurashiyya",
      "kind": "tribe"
    },
    {
      "arabic": "العامرية",
      "english": "al-'Amiriyya",
      "kind": "tribe"
    },
    {
      "arabic": "أم جميل",
      "english": "Umm Jamil",
      "kind": "person"
    },
    {
      "arabic": "ابن إسحاق",
      "english": "Ibn Ishaq",
      "kind": "person"
    },
    {
      "arabic": "يونس بن بكير",
      "english": "Yunus ibn Bukayr",
      "kind": "person"
    },
    {
      "arabic": "الحبشة",
      "english": "Abyssinia",
      "kind": "place"
    },
    {
      "arabic": "حاطب بن الحارث",
      "english": "Hatib ibn al-Harith",
      "kind": "person"
    },
    {
      "arabic": "المدينة",
      "english": "Medina",
      "kind": "place"
    },
    {
      "arabic": "عبد الله بن الحارث بن محمد بن حاطب",
      "english": "Abd Allah ibn al-Harith ibn Muhammad ibn Hatib",
      "kind": "person"
    },
    {
      "arabic": "النبي",
      "english": "Muhammad",
      "kind": "person"
    },
    {
      "arabic": "محمد بن حاطب",
      "english": "Muhammad ibn Hatib",
      "kind": "person"
    }
  ],
  "unresolved": [],
  "translation": {
    "state": "translated",
    "machine_assessment": "passed",
    "human_review": "unreviewed"
  },
  "provenance": {
    "importer": "al-isabah.volume8-importer.v1",
    "source_artifact_id": "firstlight:firstlight-research/data/translated/ibn_hajar_isabah/arabic_v1/volume_08.translation-units.jsonl",
    "source_artifact_sha256": "f12585cea28d7c7b318728f74b1a95a0d8b2812cb25d6e70f1b9e7b0b9422a3f"
  }
}
