{
  "schema": "al-isabah.entry.v1",
  "id": "isabah-entry-00011141",
  "work_id": "ibn-hajar-al-isabah",
  "edition_id": "dar-al-kutub-al-ilmiyyah-1995",
  "printed_entry_number": 11141,
  "title": {
    "english": "Khawla³ bint al-Aswad",
    "arabic_observed": "خولة «٣» بنت الأسود ،"
  },
  "segments": [
    {
      "id": "isabah-entry-00011141-segment-0001",
      "volume": 8,
      "scan_page": 124,
      "printed_page": 123,
      "reader_page": 4036,
      "reader_url": "https://usul.ai/t/isaba-fi-tamyiz/4036",
      "source_unit_id": "ibn_hajar_isabah_v1:arabic:v08:p0124:be7e73d2da8c3ecc",
      "arabic": "١١١٤١\n- خولة «٣» بنت الأسود ،\nوخويلة بنت ثعلبة. وخويلة بنت حكيم. وخويلة بنت خويلد، وخويلة بنت قيس- تقدمن.",
      "english": "11141 — Khawla³ bint al-Aswad\n\nKhuwayla bint Tha'laba, Khuwayla bint Hakim, Khuwayla bint Khuwaylid, and Khuwayla bint Qays were mentioned above.",
      "arabic_sha256": "d6da18c265fb6184c6f4bca89da8e9f6b748f2a7ee03a9e2bc8037558621bbc1",
      "english_sha256": "ce4a82264100e2433de7ea84f44f54ab9f7480538d75a4edb335057329fd4e48",
      "machine_state": "machine_validated_unreviewed"
    }
  ],
  "names": [
    {
      "arabic": "خولة",
      "english": "Khawla",
      "kind": "person"
    },
    {
      "arabic": "خويلة",
      "english": "Khuwayla bint al-Aswad",
      "kind": "person"
    },
    {
      "arabic": "خويلة بنت ثعلبة",
      "english": "Khuwayla bint Tha'laba",
      "kind": "person"
    },
    {
      "arabic": "خويلة بنت حكيم",
      "english": "Khuwayla bint Hakim",
      "kind": "person"
    },
    {
      "arabic": "خويلة بنت خويلد",
      "english": "Khuwayla bint Khuwaylid",
      "kind": "person"
    },
    {
      "arabic": "خويلة بنت قيس",
      "english": "Khuwayla bint Qays",
      "kind": "person"
    }
  ],
  "unresolved": [],
  "translation": {
    "state": "translated",
    "machine_assessment": "passed",
    "human_review": "unreviewed"
  },
  "provenance": {
    "importer": "al-isabah.volume8-importer.v1",
    "source_artifact_id": "firstlight:firstlight-research/data/translated/ibn_hajar_isabah/arabic_v1/volume_08.translation-units.jsonl",
    "source_artifact_sha256": "f12585cea28d7c7b318728f74b1a95a0d8b2812cb25d6e70f1b9e7b0b9422a3f"
  }
}
