{
  "schema": "al-isabah.entry.v1",
  "id": "isabah-entry-00011663",
  "work_id": "ibn-hajar-al-isabah",
  "edition_id": "dar-al-kutub-al-ilmiyyah-1995",
  "printed_entry_number": 11663,
  "title": {
    "english": "Kabsha bint Abi Umama,",
    "arabic_observed": "كبشة بنت أبي أمامة ،"
  },
  "segments": [
    {
      "id": "isabah-entry-00011663-segment-0001",
      "volume": 8,
      "scan_page": 294,
      "printed_page": 293,
      "reader_page": 4206,
      "reader_url": "https://usul.ai/t/isaba-fi-tamyiz/4206",
      "source_unit_id": "ibn_hajar_isabah_v1:arabic:v08:p0294:d8f3777ebd93ed59",
      "arabic": "١١٦٦٣- كبشة بنت أبي أمامة ،\nأسعد بن زرارة «١» .\nتقدم نسبها في ترجمة أبيها، وأوصى بها أبوها إلى النبي ﷺ، فتزوّجها عبد اللَّه بن أبي حبيبة، من بني الأغر بن زيد بن العطاف، وكانت أصغر بنات أسعد، وكانت من المبايعات، وقد تقدم ذكرها في ترجمة أختها حبيبة.",
      "english": "11663 — Kabsha bint Abi Umama,\n\nAs'ad ibn Zurara.[1]\n\nHer lineage was given previously in her father's entry. Her father entrusted her to the Prophet, may Allah bless him and grant him peace, in his will. Abd Allah ibn Abi Habiba, of Banu al-Agharr ibn Zayd ibn al-Attaf, married her. She was the youngest of As'ad's daughters and was among the women who pledged allegiance. She was mentioned previously in the entry on her sister Habiba.",
      "arabic_sha256": "5dc7f49a766fbeb8554824d79cb0fa0f40c1955383b8ca418fd83a18daadd136",
      "english_sha256": "16fc48ad0d274bcf602821acf39fb9d352309865792cba67cb8ce49745a4f55b",
      "machine_state": "machine_validated_unresolved"
    }
  ],
  "names": [
    {
      "arabic": "عبد اللَّه بن أبي حبيبة",
      "english": "Abd Allah ibn Abi Habiba",
      "kind": "person"
    },
    {
      "arabic": "بني الأغر بن زيد بن العطاف",
      "english": "Banu al-Agharr ibn Zayd ibn al-Attaf",
      "kind": "tribe"
    },
    {
      "arabic": "حبيبة",
      "english": "Habiba bint Abi Umama As'ad ibn Zurara",
      "kind": "person"
    }
  ],
  "unresolved": [],
  "translation": {
    "state": "translated",
    "machine_assessment": "passed",
    "human_review": "unreviewed"
  },
  "provenance": {
    "importer": "al-isabah.volume8-importer.v1",
    "source_artifact_id": "firstlight:firstlight-research/data/translated/ibn_hajar_isabah/arabic_v1/volume_08.translation-units.jsonl",
    "source_artifact_sha256": "f12585cea28d7c7b318728f74b1a95a0d8b2812cb25d6e70f1b9e7b0b9422a3f"
  }
}
