{
  "schema": "al-isabah.entry.v1",
  "id": "isabah-entry-00011122",
  "work_id": "ibn-hajar-al-isabah",
  "edition_id": "dar-al-kutub-al-ilmiyyah-1995",
  "printed_entry_number": 11122,
  "title": {
    "english": "Khawla bint Dulayj [1]",
    "arabic_observed": "خولة بنت دليج «١»"
  },
  "segments": [
    {
      "id": "isabah-entry-00011122-segment-0001",
      "volume": 8,
      "scan_page": 119,
      "printed_page": 118,
      "reader_page": 4031,
      "reader_url": "https://usul.ai/t/isaba-fi-tamyiz/4031",
      "source_unit_id": "ibn_hajar_isabah_v1:arabic:v08:p0119:c2f10e4443c25805",
      "arabic": "١١١٢٢- خولة بنت دليج «١»\n. تقدم بيان ذلك في خولة بنت ثعلبة كذلك.",
      "english": "11122—Khawla bint Dulayj [1]\n\nThis was explained above under Khawla bint Tha'laba as well.",
      "arabic_sha256": "db67ba76a941887fc68c62ade180c39d9e5bb946ead2dfb2ba8562986bd119ee",
      "english_sha256": "7b8de1818ed4e32694bfe072ab8d9877637056634561ab993091c306f96ba9b5",
      "machine_state": "machine_validated_unresolved"
    }
  ],
  "names": [
    {
      "arabic": "خولة",
      "english": "Khawla bint Hakim",
      "kind": "person"
    },
    {
      "arabic": "خولة بنت دليج",
      "english": "Khawla bint Dulayj",
      "kind": "person"
    },
    {
      "arabic": "خولة بنت ثعلبة",
      "english": "Khawla bint Tha'laba",
      "kind": "person"
    }
  ],
  "unresolved": [],
  "translation": {
    "state": "translated",
    "machine_assessment": "passed",
    "human_review": "unreviewed"
  },
  "provenance": {
    "importer": "al-isabah.volume8-importer.v1",
    "source_artifact_id": "firstlight:firstlight-research/data/translated/ibn_hajar_isabah/arabic_v1/volume_08.translation-units.jsonl",
    "source_artifact_sha256": "f12585cea28d7c7b318728f74b1a95a0d8b2812cb25d6e70f1b9e7b0b9422a3f"
  }
}
