{
  "schema": "al-isabah.entry.v1",
  "id": "isabah-entry-00012134",
  "work_id": "ibn-hajar-al-isabah",
  "edition_id": "dar-al-kutub-al-ilmiyyah-1995",
  "printed_entry_number": 12134,
  "title": {
    "english": "Umm Abd Allah bint Aslam:",
    "arabic_observed": "أم عبد اللَّه بنت أسلم:"
  },
  "segments": [
    {
      "id": "isabah-entry-00012134-segment-0001",
      "volume": 8,
      "scan_page": 428,
      "printed_page": 427,
      "reader_page": 4340,
      "reader_url": "https://usul.ai/t/isaba-fi-tamyiz/4340",
      "source_unit_id": "ibn_hajar_isabah_v1:arabic:v08:p0428:e0ff5ef0ec0efac7",
      "arabic": "١٢١٣٤- أم عبد اللَّه بنت أسلم:\nاسمها سلمى. تقدّمت.",
      "english": "12134—Umm Abd Allah bint Aslam:\n\nHer name was Salma. She has appeared previously.",
      "arabic_sha256": "b779039742e1fec127081e3c8b9c94616b54b9fe88d2e07013bd582d3228e1de",
      "english_sha256": "61382cc8198dd64459b1d0073c53e5616501a96d07e97709255a815c9e130cf3",
      "machine_state": "machine_validated_unresolved"
    }
  ],
  "names": [
    {
      "arabic": "أم عبد الله بنت أسلم",
      "english": "Umm Abd Allah bint Aslam",
      "kind": "person"
    },
    {
      "arabic": "سلمى",
      "english": "Salma",
      "kind": "person"
    }
  ],
  "unresolved": [],
  "translation": {
    "state": "translated",
    "machine_assessment": "passed",
    "human_review": "unreviewed"
  },
  "provenance": {
    "importer": "al-isabah.volume8-importer.v1",
    "source_artifact_id": "firstlight:firstlight-research/data/translated/ibn_hajar_isabah/arabic_v1/volume_08.translation-units.jsonl",
    "source_artifact_sha256": "f12585cea28d7c7b318728f74b1a95a0d8b2812cb25d6e70f1b9e7b0b9422a3f"
  }
}
