{
  "schema": "al-isabah.entry.v1",
  "id": "isabah-entry-00010823",
  "work_id": "ibn-hajar-al-isabah",
  "edition_id": "dar-al-kutub-al-ilmiyyah-1995",
  "printed_entry_number": 10823,
  "title": {
    "english": "Umama bint Khadij al-Ansariyya,",
    "arabic_observed": "أمامة بنت خديج الأنصارية ،"
  },
  "segments": [
    {
      "id": "isabah-entry-00010823-segment-0001",
      "volume": 8,
      "scan_page": 24,
      "printed_page": 23,
      "reader_page": 3936,
      "reader_url": "https://usul.ai/t/isaba-fi-tamyiz/3936",
      "source_unit_id": "ibn_hajar_isabah_v1:arabic:v08:p0024:9daa7b0cd1c9a79c",
      "arabic": "١٠٨٢٣- أمامة بنت خديج الأنصارية ،\nأخت رافع بن خديج.\n(١) البيت لحسان وهو في ديوانه ص ٢١٩ وبعده:\nأخي ثقة يهتزّ للعرف والنّدى ... بعيد المدى في النّائبات صبور\nفقلت لها إن الشهادة راحة ... ورضوان ربّ يا أمام غفور",
      "english": "10823—Umama bint Khadij al-Ansariyya,\n\nsister of Rafi' ibn Khadij.\n\n¹ The verse is by Hassan and appears in his Diwan, p. 219. After it comes:\n\nMy trustworthy brother, stirred to generosity and munificence,\nfar-reaching in adversity and steadfast.\n\nI said to her: Martyrdom is repose,\nand the good pleasure of a forgiving Lord, O Umama.",
      "arabic_sha256": "519294e505d825845e03c3497ac3380b69e5321edfc69343f4ad64c3c4549e8f",
      "english_sha256": "c272fbbe23579dcc66ff630e2c4795eb54a9faa61df72efe525cdb3730ee14a4",
      "machine_state": "machine_validated_unreviewed"
    },
    {
      "id": "isabah-entry-00010823-segment-0002",
      "volume": 8,
      "scan_page": 25,
      "printed_page": 24,
      "reader_page": 3937,
      "reader_url": "https://usul.ai/t/isaba-fi-tamyiz/3937",
      "source_unit_id": "ibn_hajar_isabah_v1:arabic:v08:p0025:844818361ccf1b32",
      "arabic": "أسلمت وبايعت رسول اللَّه ﷺ، وتزوجت أسيد بن ظهير، فولدت له ثابتا، ومحمدا، وأم كلثوم، وأم الحسن. ذكرها ابن سعد، قال: وأمها حليمة بنت عروة بن مسعود بن عامر البياضية.",
      "english": "She embraced Islam and pledged allegiance to the Messenger of Allah, may Allah bless him and grant him peace. She married Usayd ibn Zuhayr and bore him Thabit, Muhammad, Umm Kulthum, and Umm al-Hasan. Ibn Sa'd mentioned her and said: Her mother was Halima bint Urwa ibn Mas'ud ibn Amir, of Banu Bayada.",
      "arabic_sha256": "da9a1a42e915e371f0f3ac2c67a0c89ae3605bac62554e86570774aae8803e0d",
      "english_sha256": "5abdfec8c47804e770ece67ac965bd7a1c4291eda4218b122ac405d84b98fcdb",
      "machine_state": "machine_validated_unreviewed"
    }
  ],
  "names": [
    {
      "arabic": "أمامة بنت خديج الأنصارية",
      "english": "Umama bint Khadij al-Ansariyya",
      "kind": "person"
    },
    {
      "arabic": "رافع بن خديج",
      "english": "Rafi' ibn Khadij",
      "kind": "person"
    },
    {
      "arabic": "اللَّه",
      "english": "Allah",
      "kind": "other"
    },
    {
      "arabic": "رسول اللَّه / النبي",
      "english": "Muhammad",
      "kind": "person"
    },
    {
      "arabic": "أسيد بن ظهير",
      "english": "Usayd ibn Zuhayr",
      "kind": "person"
    },
    {
      "arabic": "حليمة بنت عروة بن مسعود بن عامر البياضية",
      "english": "Halima bint Urwa ibn Mas'ud ibn Amir",
      "kind": "person"
    },
    {
      "arabic": "بياضة / البياضية",
      "english": "Banu Bayada",
      "kind": "tribe"
    }
  ],
  "unresolved": [],
  "translation": {
    "state": "translated",
    "machine_assessment": "passed",
    "human_review": "unreviewed"
  },
  "provenance": {
    "importer": "al-isabah.volume8-importer.v1",
    "source_artifact_id": "firstlight:firstlight-research/data/translated/ibn_hajar_isabah/arabic_v1/volume_08.translation-units.jsonl",
    "source_artifact_sha256": "f12585cea28d7c7b318728f74b1a95a0d8b2812cb25d6e70f1b9e7b0b9422a3f"
  }
}
